{
  "creationTime": "2025-03-15T14:30:00Z",
  "alarmModelArn": "arn:aws:iot:us-east-1:123456789012:thing/example",
  "alarmModelVersion": "example-value",
  "lastUpdateTime": "2025-03-15T14:30:00Z",
  "status": "ACTIVE",
  "statusMessage": "ACTIVE",
  "alarmModelName": "example-resource",
  "alarmModelDescription": "example-value",
  "roleArn": "arn:aws:iot:us-east-1:123456789012:thing/example",
  "key": "example-value",
  "severity": "example-value",
  "alarmRule": "example-value",
  "alarmNotification": "example-value",
  "alarmEventActions": "example-value",
  "alarmCapabilities": "example-value"
}